{
  "schema_version": "1.0",
  "task_id": "unsupported-001",
  "sender": "user",
  "recipient": "orchestrator",
  "instructions": "Translate the supplied context.",
  "context": { "capability": "translation" },
  "status": "queued",
  "created_at": "2026-09-30T12:00:00Z",
  "updated_at": "2026-09-30T12:00:00Z"
}
